1,vanilla ice cream,1,0.01,true,Classic creamy vanilla ice cream made with Madagascar vanilla beans,1,https://images.unsplash.com/photo-1570197571499-95da1c16d4f4,100
2,chocolate ice cream,1,0.01,true,Rich and creamy chocolate ice cream made with premium cocoa,1,https://images.unsplash.com/photo-1563805042-7684c019e1cb,100
3,strawberry ice cream,1,0.01,true,Fresh strawberry ice cream made with real fruit pieces,1,https://images.unsplash.com/photo-1488900128323-21503983a07e,100
4,6-pack of paycheck pilsners,1,0.01,true,Crisp and refreshing craft pilsner beer sold in packs of 6,2,https://images.unsplash.com/photo-1586993451228-09818021e309,100
5,seven fabergé easter eggs,1,1199000.00,true,Collection of seven imperial Fabergé eggs featuring intricate designs and precious gems,3,https://images.unsplash.com/photo-1618336753974-aae8e04506aa,100
6,painting - the storm on the sea of galilee,1,44000000.00,true,Rembrandt's only known seascape painting stolen from the Isabella Stewart Gardner Museum in 1990,4,https://upload.wikimedia.org/wikipedia/commons/f/f3/Rembrandt_Christ_in_the_Storm_on_the_Lake_of_Galilee.jpg,100
7,Either Foundation,5,442.02,False,Thank PM drive message development vote safe everybody behavior dog figure subject situation try everyone management situation.,5,https://example.com/images/either_foundation.jpg,100
8,Operation Lipstick,10,292.14,True,Bill big able education none family crime standard once about list health director special hard.,5,https://example.com/images/operation_lipstick.jpg,100
9,One Hiking Shoes,5,177.23,False,Congress hotel amount military financial Mr have decide social.,3,https://example.com/images/one_hiking_shoes.jpg,100
10,Deal Smartphone,9,321.69,True,Place blue lead day into send argue anyone place travel cell already.,1,https://example.com/images/deal_smartphone.jpg,100
11,Seek Hat,1,440.79,False,Method quickly bank raise analysis sport seat couple what experience history war production fire.,4,https://example.com/images/seek_hat.jpg,100
12,Class Smartphone,7,122.92,False,Appear nature discussion so but still describe conference weight always election draw.,1,https://example.com/images/class_smartphone.jpg,100
13,Movie Socks,1,129.42,False,Official point rise day respond how eye opportunity economy experience computer though.,4,https://example.com/images/movie_socks.jpg,100
14,Way T-Shirt,8,44.94,True,Activity off structure west finish office half in if never theory wait stop sometimes its interesting how similar.,4,https://example.com/images/way_t-shirt.jpg,100
15,Detail Moisturizer,10,124.16,False,Tree mind staff teach former face most in data cut kind share likely receive crime want break level doctor pull.,5,https://example.com/images/detail_moisturizer.jpg,100
16,For Sneakers,5,372.83,False,Or purpose artist order that ahead sport memory today service difference job.,4,https://example.com/images/for_sneakers.jpg,100
17,Two Jacket,1,485.95,True,Near religious trade grow require benefit trouble many economy.,4,https://example.com/images/two_jacket.jpg,100
18,Itself Smartwatch,8,276.9,False,Whom several politics live let serious anything treat rise style.,1,https://example.com/images/itself_smartwatch.jpg,100
19,Size Headphones,10,300.48,False,That treat full subject if price five else make send about cup protect front you community.,1,https://example.com/images/size_headphones.jpg,100
20,Choice Perfume,3,32.13,True,Medical material local resource wear real technology information sport her step may statement four friend call leader.,5,https://example.com/images/choice_perfume.jpg,100
21,Story Kayak,1,11.76,True,Worker large thought doctor place score stuff member black because institution including mind wear size.,3,https://example.com/images/story_kayak.jpg,100
22,Pressure Air Fryer,1,109.69,False,Wife inside task return station paper key wait garden a customer for result perhaps really type season low whether career.,2,https://example.com/images/pressure_air_fryer.jpg,100
23,Data Backpack,3,267.37,True,During occur artist site perhaps though role add relationship class effect present population black tree.,3,https://example.com/images/data_backpack.jpg,100
24,Baby Dishwasher,6,22.31,False,Prove themselves scientist quickly lead smile out pattern customer second possible near too how model medical require option run hospital.,2,https://example.com/images/baby_dishwasher.jpg,100
25,Certainly Backpack,1,127.25,True,May nation run employee task mean minute if seven live friend look performance real couple forward.,3,https://example.com/images/certainly_backpack.jpg,100
26,Keep Headphones,8,154.36,True,Writer boy close ok structure well this industry life way ground year finally blood.,1,https://example.com/images/keep_headphones.jpg,100
27,Reality Jeans,8,168.77,False,Special middle into identify I cell change most safe him protect admit enough fear already.,4,https://example.com/images/reality_jeans.jpg,100
28,Choice Microwave,2,254.35,False,Away view letter southern write our hear two plant forward field.,2,https://example.com/images/choice_microwave.jpg,100
29,Affect Jacket,9,421.53,False,Sort try fear someone reason plan after easy environment several.,4,https://example.com/images/affect_jacket.jpg,100
30,Short Kayak,10,107.49,True,Forward both program maintain have anything charge audience pull pass night imagine safe place image free.,3,https://example.com/images/short_kayak.jpg,100
31,Much Smartwatch,2,270.79,False,Subject political government book than worker spend wear human eye life nearly.,1,https://example.com/images/much_smartwatch.jpg,100
32,Interest Laptop,8,145.55,False,Minute military add plant career set range foreign alone especially pull grow kitchen itself.,1,https://example.com/images/interest_laptop.jpg,100
33,Wait Backpack,9,420.52,False,Shake bad word personal must customer nation police friend police accept final have page professional where rule court.,3,https://example.com/images/wait_backpack.jpg,100
34,Look Socks,7,455.89,False,It ahead development he natural rest along inside finish anyone win hundred while ten event.,4,https://example.com/images/look_socks.jpg,100
35,These Smartphone,1,326.14,True,Language traditional pay same learn affect firm example early gas window many treatment class lay reason.,1,https://example.com/images/these_smartphone.jpg,100
36,Ball Coffee Maker,1,374.03,True,Want raise job away marriage support game explain he smile group card size capital.,2,https://example.com/images/ball_coffee_maker.jpg,100
37,Hospital Laptop,10,149.1,True,Society beat the product body look ok scientist necessary woman day myself.,1,https://example.com/images/hospital_laptop.jpg,100
38,Guess Vacuum Cleaner,7,372.74,True,By decision responsibility hard Democrat father involve lose everybody car deal.,2,https://example.com/images/guess_vacuum_cleaner.jpg,100
39,Film Headphones,1,463.27,True,Check particularly movie eight great wonder light professor protect meeting type into use where direction.,1,https://example.com/images/film_headphones.jpg,100
40,Public Foundation,6,483.86,False,Senior might area plan marriage effort six model build will girl production.,5,https://example.com/images/public_foundation.jpg,100
41,Him Coffee Maker,6,352.41,False,Pay deal reality measure rich later whatever safe finally money suddenly quite defense cover require ball.,2,https://example.com/images/him_coffee_maker.jpg,100
42,Piece Hat,7,118.62,False,Kind sometimes group officer however this debate son medical radio.,4,https://example.com/images/piece_hat.jpg,100
43,Late Camera,9,299.16,True,Probably these debate sit clearly market where policy simply else office with role.,1,https://example.com/images/late_camera.jpg,100
44,Research Conditioner,5,51.51,False,Style before personal bad west remember tax force save.,5,https://example.com/images/research_conditioner.jpg,100
45,Able Dishwasher,1,379.37,True,Water later bill kid build front someone see exactly travel list ok force.,2,https://example.com/images/able_dishwasher.jpg,100
46,View Hat,2,205.65,False,Their statement surface itself understand parent moment message kind mean campaign hand.,4,https://example.com/images/view_hat.jpg,100
47,Focus Perfume,10,13.21,True,Past poor significant international condition section future affect dog his personal prove eat public national cost treat here.,5,https://example.com/images/focus_perfume.jpg,100
48,Usually Socks,4,361.8,False,Well other speak game film simple message camera outside town consider mention owner then eat land green.,4,https://example.com/images/usually_socks.jpg,100
49,Everybody Foundation,10,488.34,True,Movement community sort performance his gun under start total occur improve major time drop concern style.,5,https://example.com/images/everybody_foundation.jpg,100
50,Else Laptop,3,417.19,True,Green experience major hard several everyone treat gun medical less significant game.,1,https://example.com/images/else_laptop.jpg,100
51,Political Microwave2,1,223.87,False,Fact glass maybe choose song also rate space word rule detail tree pressure answer.,2,https://example.com/images/political_microwave.jpg,100
52,Budget Camera,1,304.98,False,Share section body area six explain property can officer throw and thousand similar.,1,https://example.com/images/budget_camera.jpg,100
53,Across Coffee Maker,2,424.35,True,Scene significant message public red environmental mind drug source energy activity.,2,https://example.com/images/across_coffee_maker.jpg,100
54,Go Smartwatch,2,314.34,True,Need teach physical set visit back least million south yard amount leg hospital director business new.,1,https://example.com/images/go_smartwatch.jpg,100
55,Worker Tent,8,11.69,True,Series start system husband within project stuff always all reason score tax somebody.,3,https://example.com/images/worker_tent.jpg,100
56,Major Shampoo,9,146.45,True,Pm agency head hand modern budget particularly need agent research big.,5,https://example.com/images/major_shampoo.jpg,100
57,Nearly Coffee Maker,7,377.19,True,Television probably cup prepare be order source here floor well series sea development fight vote.,2,https://example.com/images/nearly_coffee_maker.jpg,100
58,Benefit Foundation,8,419.76,True,Knowledge blood raise challenge partner it find case suffer prevent to buy billion partner candidate expert how generation.,5,https://example.com/images/benefit_foundation.jpg,100
59,Compare Hiking Shoes,8,82.11,False,Stock deep admit class include property base finish unit big over change low phone thus challenge consumer smile enough.,3,https://example.com/images/compare_hiking_shoes.jpg,100
60,Stuff Tent,8,207.35,False,Home suggest center our lead local small evening organization present leader family treatment.,3,https://example.com/images/stuff_tent.jpg,100
61,Majority Lipstick,9,57.76,False,Find treat candidate once bag person writer partner raise and much by sit outside boy stage.,5,https://example.com/images/majority_lipstick.jpg,100
62,Thus Tablet,8,193.94,True,Dream debate economic trouble somebody increase happen your reach adult wear since fish debate scene only area.,1,https://example.com/images/thus_tablet.jpg,100
63,Same Air Fryer,10,171.67,False,Paper follow our dog approach study somebody just including rather morning stop past movement tough.,2,https://example.com/images/same_air_fryer.jpg,100
64,Image Air Fryer,5,123.44,True,Piece century art data great deal laugh young main see beyond push ball artist how rest.,2,https://example.com/images/image_air_fryer.jpg,100
65,Short Sneakers,5,470.69,True,Either bill write then half least lay food push maintain increase service tax knowledge structure view outside modern region.,4,https://example.com/images/short_sneakers.jpg,100
66,Organization Hiking Shoes,10,148.08,True,Tax else your out start born continue century yourself particularly worry police final himself develop deal against.,3,https://example.com/images/organization_hiking_shoes.jpg,100
67,Your Hiking Shoes,10,465.61,False,Rest quality center beyond property so position receive guess white treat tree price toward all work choose.,3,https://example.com/images/your_hiking_shoes.jpg,100
68,Across Backpack,3,104.04,True,See continue be region up current majority move deal likely admit under create live so.,3,https://example.com/images/across_backpack.jpg,100
69,Face Blender,4,344.1,False,Care board perform long cause hear tax learn different ground raise study order.,2,https://example.com/images/face_blender.jpg,100
70,Past Microwave,5,184.23,True,Determine catch Mrs machine everything maintain same stand field.,2,https://example.com/images/past_microwave.jpg,100
71,Pressure Microwave,10,403.53,False,Cause begin few another mean right tell activity the discover reduce institution this.,2,https://example.com/images/pressure_microwave.jpg,100
72,Position Moisturizer,6,225.85,True,Wind region cold modern allow with floor system deal maintain participant detail kind present.,5,https://example.com/images/position_moisturizer.jpg,100
73,Nor Vacuum Cleaner,2,121.45,True,Seem small mission include work candidate grow feeling visit go scene.,2,https://example.com/images/nor_vacuum_cleaner.jpg,100
74,Per Dishwasher,10,325.16,True,Its society whatever special early against least read produce pay only feeling produce meet middle PM.,2,https://example.com/images/per_dishwasher.jpg,100
75,National Sneakers,7,49.27,False,How environmental born admit television west tell establish author college light recognize.,4,https://example.com/images/national_sneakers.jpg,100
76,Society Hiking Shoes,9,434.31,True,Similar none action discussion by throw better effort argue.,3,https://example.com/images/society_hiking_shoes.jpg,100
77,Six Jeans,2,115.82,True,Consider sure what could cost kitchen imagine race prove arrive list goal light quickly.,4,https://example.com/images/six_jeans.jpg,100
78,Treatment Coffee Maker,1,87.58,False,Try nature relationship party eight surface must doctor truth individual capital movie phone performance.,2,https://example.com/images/treatment_coffee_maker.jpg,100
79,Commercial Coffee Maker,4,438.74,False,Report effort mission interesting charge keep major form among wide believe.,2,https://example.com/images/commercial_coffee_maker.jpg,100
80,Fill Camera,7,323.25,False,Rate book whose with your three alone whom where.,1,https://example.com/images/fill_camera.jpg,100
81,Main Vacuum Cleaner,10,276.73,True,Occur window street expert market sing brother position idea visit commercial mind trip say enjoy suggest small add picture.,2,https://example.com/images/main_vacuum_cleaner.jpg,100
82,Produce Vacuum Cleaner,1,52.55,True,Raise certainly reduce shake interesting today watch difference should return along pick.,2,https://example.com/images/produce_vacuum_cleaner.jpg,100
83,Size Tablet,6,467.18,True,Yeah nothing involve practice green never into which network commercial indeed project save exactly least baby blood effect career.,1,https://example.com/images/size_tablet.jpg,100
84,Of Jacket,8,264.42,False,Forward her key front decade heavy real only name game song tax response modern policy.,4,https://example.com/images/of_jacket.jpg,100
85,Leg Microwave,8,27.14,True,Form evening rate idea health science either time talk picture.,2,https://example.com/images/leg_microwave.jpg,100
86,Fall Sneakers,6,281.99,True,Particularly administration easy sometimes board enter wife school rich matter organization position large glass fire though a throughout summer.,4,https://example.com/images/fall_sneakers.jpg,100
87,Away Lipstick,7,95.61,False,Join hope project down society wonder act force cut size future season power.,5,https://example.com/images/away_lipstick.jpg,100
88,Paper Moisturizer,2,102.4,True,Control floor course sometimes clear this find production religious at.,5,https://example.com/images/paper_moisturizer.jpg,100
89,Too Hiking Shoes,1,107.17,True,Congress owner feeling red piece fall size top back necessary camera including suddenly conference into military interest.,3,https://example.com/images/too_hiking_shoes.jpg,100
90,Can Blender,7,313.83,False,Yet remain catch yourself inside someone road carry the tell.,2,https://example.com/images/can_blender.jpg,100
91,Strong Blender,7,317.57,False,Beautiful new check offer serious manager build agreement picture.,2,https://example.com/images/strong_blender.jpg,100
92,Occur Kayak,5,210.88,True,Doctor reality according later to technology Republican nature whole public truth receive change.,3,https://example.com/images/occur_kayak.jpg,100
93,Campaign Shampoo,2,104.4,True,Test drop soon front success most Republican others born whole loss foot medical note.,5,https://example.com/images/campaign_shampoo.jpg,100
94,Through Laptop,7,73.05,False,Ability address system product check store believe once nation actually front yard soldier tell appear stock character.,1,https://example.com/images/through_laptop.jpg,100
95,Success Sneakers,9,427.74,True,Data shoulder fight hot either my PM medical sea career even strong music.,4,https://example.com/images/success_sneakers.jpg,100
96,Participant Moisturizer,9,310.74,False,Share guy turn all article realize keep century his.,5,https://example.com/images/participant_moisturizer.jpg,100
97,Threat Tent,6,339.74,False,Science daughter trial change specific manage someone leave small impact red foreign ahead.,3,https://example.com/images/threat_tent.jpg,100
98,Make Kayak,4,431.41,False,Truth region hotel require prove memory trouble adult break resource home physical team.,3,https://example.com/images/make_kayak.jpg,100
99,Happy Dishwasher,8,280.45,True,Represent official current black rich score agreement knowledge cut oil.,2,https://example.com/images/happy_dishwasher.jpg,100
100,Yard Laptop,10,395.99,False,This area evidence activity always laugh front listen world stand kitchen form minute doctor scientist foot which thing tree.,1,https://example.com/images/yard_laptop.jpg,100